{
  "schema": "curveyield-development-authority-import/v1",
  "request_id": "dev-authority-skill-v38.3.4-v3",
  "source": {
    "type": "google-drive",
    "url": "https://drive.google.com/file/d/1pdvc5zkXH2QsnmmF-RAMlU1kT_hO1BWR/view?usp=drivesdk",
    "drive_file_id": "1pdvc5zkXH2QsnmmF-RAMlU1kT_hO1BWR",
    "filename": "Audit_V7_independent_Review_skill_v38.3.4_Web_Bootstrap_Optimized(4).zip",
    "format": "zip",
    "sha256": "aed298c90c3de3bf9e64bf7e49853b7efd994c47ef9e88cc8f35f60977314cd8",
    "size": 627729
  },
  "target": {
    "repository": "CurveYield2/Contract-Automation",
    "branch": "main",
    "path": "process/development-agent-task-manager/authority/raw/Audit_V7_independent_Review_skill_v38.3.4_Web_Bootstrap_Optimized(4).zip"
  }
}
