{
  "schema": "curveyield-development-authority-import/v1",
  "request_id": "dev-authority-upgrade-handoff-packet-v3",
  "source": {
    "type": "google-drive",
    "url": "https://drive.google.com/file/d/1OlNot-JfcRJUCMeR3lnzwMm2FYKWL8aK/view?usp=drivesdk",
    "drive_file_id": "1OlNot-JfcRJUCMeR3lnzwMm2FYKWL8aK",
    "filename": "CurveYield_Audit_Automation_Upgrade_Handoff_v1(1).zip",
    "format": "zip",
    "sha256": "f2d38c0d23a03322028d79fbc6bbbd0e8cb484f57978d7ebe5bd6183e6111b12",
    "size": 24042
  },
  "target": {
    "repository": "CurveYield2/Contract-Automation",
    "branch": "main",
    "path": "process/development-agent-task-manager/authority/raw/CurveYield_Audit_Automation_Upgrade_Handoff_v1(1).zip"
  }
}
