{
  "schema": "curveyield-development-authority-import/v1",
  "request_id": "dev-authority-current-status-handoff-v2",
  "source": {
    "type": "google-drive",
    "url": "https://drive.google.com/file/d/1H9wJaHBssIv2VjVBf3dasYX7Qgz5pFSZ/view?usp=drivesdk",
    "drive_file_id": "1H9wJaHBssIv2VjVBf3dasYX7Qgz5pFSZ",
    "filename": "CURRENT_DEVELOPMENT_STATUS_HANDOFF_v1.md",
    "format": "raw",
    "sha256": "6db1adbf6641c570c7002263b9db6c4d1f852f61cb89ce09338a45ae3a84baba",
    "size": 6733
  },
  "target": {
    "repository": "CurveYield2/Contract-Automation",
    "branch": "main",
    "path": "process/development-agent-task-manager/status/CURRENT_DEVELOPMENT_STATUS_HANDOFF_v1.md"
  }
}
